{
  "name": "Vote 4: Minecraft-Server-List",
  "description": "Fills username, waits for the button, clicks Click to Vote. Invisible reCAPTCHA. Pass --var username=YOURNAME.",
  "vars": { "username": "" },
  "steps": [
    { "type": "open_url", "url": "https://minecraft-server-list.com/server/288369/vote/", "browser": "chrome" },
    { "type": "wait_for", "selector": "#ignnn", "timeoutMs": 30000 },
    { "type": "fill", "selector": "#ignnn", "text": "{username}" },
    { "type": "click_confirm", "selector": "#voteButton", "attempts": 3, "gapMs": 3000 },
    { "type": "manual", "message": "Solve the reCAPTCHA if one appears, then wait.", "timeoutMs": 15000 }
  ]
}
